{
  "schemaVersion": "1.1.0",
  "registryId": "ontology-validation-system",
  "title": "本体校验系统设计图谱",
  "subtitle": "以原子校验器、关系图和可审计 DAG 构成可信发布控制面",
  "updated": "2026-07-13",
  "language": "zh-CN",
  "sourceNote": "本 JSON 是展示页面的唯一运行时数据源；初始内容由完整本体校验矩阵导入，后续设计变更应优先更新本文件。",
  "counts": {
    "chapters": 13,
    "validators": 196,
    "coreValidators": 81
  },
  "principles": [
    {
      "title": "分层判定",
      "text": "语法、逻辑、数据、语义和任务可用性分别验证，任何单一引擎都不代表总体正确。"
    },
    {
      "title": "权限受可判定性约束",
      "text": "规范明确且可复现的硬约束可以否决；统计和语义判断只计分或建议。"
    },
    {
      "title": "证据先行",
      "text": "事实、公理、规则和流程都应保留来源、范围、版本与转换过程。"
    },
    {
      "title": "失败可逆",
      "text": "违规对象进入隔离与复核，不静默删除；修复、放行和接受风险都必须可审计。"
    },
    {
      "title": "发布可追踪",
      "text": "校验结果、影响分析、版本、工具链和已知盲区随发布制品一起归档。"
    }
  ],
  "designElements": [
    {
      "id": "identity",
      "label": "身份与版本",
      "term": "Stable Identity",
      "question": "谁在执行？",
      "contract": "稳定 ID、版本、所有者、配置摘要和工具镜像必须可追踪。"
    },
    {
      "id": "scope",
      "label": "作用域",
      "term": "Scope",
      "question": "校验边界在哪里？",
      "contract": "明确单制品、导入闭包、全局图、变更集或运行态边界。"
    },
    {
      "id": "input",
      "label": "输入契约",
      "term": "Input Contract",
      "question": "依赖什么？",
      "contract": "声明必需制品、前置节点、配置、基线和输入哈希。"
    },
    {
      "id": "criterion",
      "label": "判定契约",
      "term": "Decision Criterion",
      "question": "凭什么判断？",
      "contract": "给出可复现判据、阈值、标准版本和已知不可判定边界。"
    },
    {
      "id": "execution",
      "label": "执行契约",
      "term": "Execution Contract",
      "question": "怎样运行？",
      "contract": "固定引擎、资源预算、超时、重试、缓存键和隔离策略。"
    },
    {
      "id": "verdict",
      "label": "结论契约",
      "term": "Verdict Contract",
      "question": "输出什么状态？",
      "contract": "至少区分 pass、fail、warn、unknown 与 abstain；异常不得记作通过。"
    },
    {
      "id": "authority",
      "label": "决策权限",
      "term": "Decision Authority",
      "question": "结论能做什么？",
      "contract": "权限限定为否决、计分、建议或人工批准，并声明升级路径。"
    },
    {
      "id": "evidence",
      "label": "证据与输出",
      "term": "Evidence Contract",
      "question": "如何解释与复核？",
      "contract": "输出稳定 finding、证据定位、指标、诊断和可选修复草案。"
    },
    {
      "id": "cost",
      "label": "成本预算",
      "term": "Cost Budget",
      "question": "何时值得运行？",
      "contract": "声明时间、计算、数据、专家和研究不确定性成本，供编排器排程。"
    }
  ],
  "scopes": {
    "package": {
      "code": "PKG",
      "label": "制品包",
      "term": "Artifact Package",
      "description": "manifest 声明的文件、版本、依赖和安全边界。"
    },
    "ontology": {
      "code": "ONT",
      "label": "本体模块",
      "term": "Ontology Module",
      "description": "单一本体模块及其显式公理和元数据。"
    },
    "closure": {
      "code": "CLS",
      "label": "导入闭包",
      "term": "Import Closure",
      "description": "根本体与固定 imports 闭包形成的完整语义边界。"
    },
    "graph": {
      "code": "KG",
      "label": "实例图",
      "term": "Instance Graph",
      "description": "指定数据图、命名图集合及其推理前后状态。"
    },
    "evidence": {
      "code": "EVD",
      "label": "证据单元",
      "term": "Evidence Unit",
      "description": "事实或公理与来源片段、位置、版本之间的证据包。"
    },
    "source": {
      "code": "SRC",
      "label": "源与映射",
      "term": "Source and Mapping",
      "description": "结构化源、SQL、R2RML/OBDA 映射与虚拟图。"
    },
    "task": {
      "code": "TASK",
      "label": "任务集合",
      "term": "Task Suite",
      "description": "能力问题、查询、结果断言和下游任务样本。"
    },
    "corpus": {
      "code": "CORP",
      "label": "语料与 Gold",
      "term": "Corpus and Gold Set",
      "description": "抽取语料、标注集、seen/blind 划分和评测基线。"
    },
    "runtime": {
      "code": "RUN",
      "label": "规则与流程运行态",
      "term": "Rule and Process Runtime",
      "description": "规则集、流程模型、业务状态、事件日志和仿真上下文。"
    },
    "release": {
      "code": "REL",
      "label": "变更与发布",
      "term": "Change and Release",
      "description": "候选版本、上一基线、影响面、访问控制和发布制品。"
    },
    "validator": {
      "code": "META",
      "label": "校验器自身",
      "term": "Validator Assurance",
      "description": "校验规则、引擎、测试夹具、误差和性能边界。"
    }
  },
  "authorities": {
    "veto": {
      "code": "V",
      "label": "否决",
      "term": "Veto",
      "description": "阻止入库或发布；对象进入隔离区，保留完整证据。",
      "color": "#C33F4A"
    },
    "score": {
      "code": "S",
      "label": "计分",
      "term": "Score",
      "description": "形成 finding、风险分与趋势，不直接删除对象。",
      "color": "#167D8D"
    },
    "advise": {
      "code": "A",
      "label": "建议",
      "term": "Advise",
      "description": "语义判断和修复草案，允许不确定；不得自动写入。",
      "color": "#B56B16"
    },
    "human": {
      "code": "H",
      "label": "人工批准",
      "term": "Human Approval",
      "description": "批准高影响修复、接受风险和签发正式版本。",
      "color": "#74529C"
    }
  },
  "costs": {
    "low": {
      "label": "低成本",
      "description": "静态扫描或现有标准库即可实现。"
    },
    "medium": {
      "label": "中成本",
      "description": "需要跨文件索引、稳定诊断或完整测试夹具。"
    },
    "high": {
      "label": "高成本",
      "description": "需要数据库、推理器、端到端环境或专家 gold。"
    },
    "research": {
      "label": "研究型",
      "description": "正确答案不完全可判定，需要统计、模型和专家共同判断。"
    }
  },
  "relationTypes": {
    "requires": {
      "label": "前置依赖",
      "term": "Requires",
      "style": "solid",
      "description": "目标节点只有在来源节点成功或被明确放行后才能进入 ready。"
    },
    "supplies": {
      "label": "数据供给",
      "term": "Supplies",
      "style": "data",
      "description": "来源节点产生索引、推理结果、基线或证据，作为目标节点输入。"
    },
    "gates": {
      "label": "硬门禁",
      "term": "Gates",
      "style": "gate",
      "description": "来源节点失败会阻断目标节点或发布；不得以缺失结果替代通过。"
    },
    "explains": {
      "label": "诊断解释",
      "term": "Explains",
      "style": "dotted",
      "description": "来源节点解释目标 finding 的冲突集合、证据或失败归因。"
    },
    "conditional": {
      "label": "条件依赖",
      "term": "Conditional Dependency",
      "style": "dashed",
      "description": "仅当对应制品或能力出现在 manifest 中时激活该依赖。"
    },
    "escalates": {
      "label": "升级复核",
      "term": "Escalates",
      "style": "review",
      "description": "低可判定性、高影响或冲突结果进入人工复核与风险接受。"
    }
  },
  "orchestration": {
    "readinessRule": "READY = 必需前置节点完成 ∧ 输入哈希固定 ∧ 资源预算已分配 ∧ 门禁未阻断",
    "policies": [
      {
        "title": "拓扑调度",
        "term": "Topological Scheduling",
        "text": "仅调度入度归零的节点；环路属于设计错误，反馈修复必须开启新 run。"
      },
      {
        "title": "并行与扇入",
        "term": "Fan-out / Fan-in",
        "text": "共享不可变快照后并行执行独立节点，在集成、任务验收和发布点汇聚。"
      },
      {
        "title": "门禁传播",
        "term": "Gate Propagation",
        "text": "硬失败阻断依赖后继；计分与建议继续传播，但必须进入最终风险汇总。"
      },
      {
        "title": "确定性缓存",
        "term": "Deterministic Cache",
        "text": "缓存键由节点版本、输入哈希、配置和依赖输出哈希共同构成。"
      },
      {
        "title": "故障隔离",
        "term": "Failure Isolation",
        "text": "timeout、OOM、unsupported 和引擎异常独立记录为 unknown/error，不污染其他并行分支。"
      },
      {
        "title": "证据汇聚",
        "term": "Evidence Aggregation",
        "text": "每个节点输出统一 finding envelope，最终报告保留因果链、豁免和人工决定。"
      }
    ],
    "phases": [
      {
        "id": "freeze",
        "order": 1,
        "title": "冻结运行上下文",
        "term": "SNAPSHOT",
        "nodes": [
          {
            "id": "dag.snapshot",
            "label": "制品清单与不可变快照",
            "description": "解析 manifest，固定输入、依赖、策略和工具链，建立本次 run 的审计根。",
            "scope": "package",
            "authority": "veto",
            "validatorRefs": ["intake.g01", "intake.g03", "intake.g05", "intake.g07", "intake.g10"],
            "dependsOn": [],
            "conditionalOn": []
          }
        ]
      },
      {
        "id": "compile",
        "order": 2,
        "title": "编译与索引",
        "term": "COMPILE",
        "nodes": [
          {
            "id": "dag.compile-ontology",
            "label": "解析本体与导入闭包",
            "description": "建立 RDF/OWL/SHACL 语法树、imports 闭包和统一词汇索引。",
            "scope": "closure",
            "authority": "veto",
            "validatorRefs": ["conformance.s01", "conformance.s05", "conformance.s06", "conformance.s10", "conformance.s12"],
            "dependsOn": ["dag.snapshot"],
            "conditionalOn": []
          },
          {
            "id": "dag.compile-source",
            "label": "编译源 Schema 与映射",
            "description": "验证源结构与映射语法，生成可执行映射计划和引用索引。",
            "scope": "source",
            "authority": "veto",
            "validatorRefs": ["mapping.d01", "mapping.d03", "mapping.d04"],
            "dependsOn": ["dag.snapshot"],
            "conditionalOn": []
          }
        ]
      },
      {
        "id": "parallel",
        "order": 3,
        "title": "领域并行校验",
        "term": "FAN-OUT",
        "nodes": [
          {
            "id": "dag.schema-quality",
            "label": "术语与概念建模",
            "description": "扫描元数据、层级、关系、量词与结构坏味道。",
            "scope": "ontology",
            "authority": "score",
            "validatorRefs": ["metadata.m01", "metadata.m02", "modeling.p01", "modeling.p04", "modeling.p14"],
            "dependsOn": ["dag.compile-ontology"],
            "conditionalOn": []
          },
          {
            "id": "dag.abox-shacl",
            "label": "实例图与 SHACL",
            "description": "校验实例完整性、类型、基数、引用和推理边界。",
            "scope": "graph",
            "authority": "veto",
            "validatorRefs": ["abox.a01", "abox.a02", "abox.a05", "abox.a06", "abox.a09", "abox.a19"],
            "dependsOn": ["dag.compile-ontology"],
            "conditionalOn": []
          },
          {
            "id": "dag.evidence-trust",
            "label": "证据与来源忠实性",
            "description": "回查来源位置、原文、数值边界、实体链接和公理级 provenance。",
            "scope": "evidence",
            "authority": "veto",
            "validatorRefs": ["evidence.e01", "evidence.e02", "evidence.e03", "evidence.e05", "evidence.e14"],
            "dependsOn": ["dag.snapshot"],
            "conditionalOn": ["dag.compile-ontology"]
          },
          {
            "id": "dag.induction-quality",
            "label": "自动抽象质量",